<?xml version="1.0" encoding="UTF-8"?>
<xs:schema xmlns:xs="http://www.w3.org/2001/XMLSchema" targetNamespace="http://www.uniovi.es" xmlns="http://www.uniovi.es" elementFormDefault="qualified">
	<xs:element name="circuito">
		<xs:complexType>
			<xs:sequence>
				<xs:element ref="longitudCircuito" />
				<xs:element ref="anchura" />
				<xs:element ref="fecha2025" />
				<xs:element ref="hora" />
				<xs:element ref="vueltas" />
				<xs:element ref="patrocinador" />
				<xs:element ref="referencias" />
				<xs:element minOccurs="1" maxOccurs="5" ref="foto" />
				<xs:element minOccurs="1" maxOccurs="3" ref="video" />
				<xs:element ref="puntoOrigen" />
				<xs:element ref="puntos" />
				<xs:element ref="vencedor" />
				<xs:element ref="tresClasificados" />
			</xs:sequence>
			<xs:attribute name="nombre" type="xs:string" use="required" />
			<xs:attribute name="ciudad" type="xs:string" use="required" />
			<xs:attribute name="pais" type="xs:string" use="required" />
		</xs:complexType>
	</xs:element>
	<xs:element name="longitudCircuito">
		<xs:complexType>
			<xs:simpleContent>
				<xs:extension base="xs:float">
					<xs:attribute name="unidades" type="xs:string" use="required" />
				</xs:extension>
			</xs:simpleContent>
		</xs:complexType>
	</xs:element>
	<xs:element name="anchura">
		<xs:complexType>
			<xs:simpleContent>
				<xs:extension base="xs:float">
					<xs:attribute name="unidades" type="xs:string" use="required" />
				</xs:extension>
			</xs:simpleContent>
		</xs:complexType>
	</xs:element>
	<xs:element name="fecha2025" type="xs:date" />
	<xs:element name="hora" type="xs:time" />
	<xs:element name="vueltas" type="xs:int" />
	<xs:element name="patrocinador" type="xs:string" />
	<xs:element name="referencias">
		<xs:complexType>
			<xs:sequence>
				<xs:element minOccurs="3" maxOccurs="unbounded" ref="referencia" />
			</xs:sequence>
		</xs:complexType>
	</xs:element>
	<xs:element name="referencia" type="xs:string" />
	<xs:element name="foto" type="xs:string" />
	<xs:element name="video" type="xs:string" />
	<xs:element name="puntoOrigen">
		<xs:complexType>
			<xs:sequence>
				<xs:element ref="coordenada" />
			</xs:sequence>
		</xs:complexType>
	</xs:element>

	<xs:element name="coordenada">
		<xs:complexType>
			<xs:sequence>
				<xs:element ref="latitud" />
				<xs:element ref="longitud" />
				<xs:element ref="altitud" />
			</xs:sequence>
		</xs:complexType>
	</xs:element>

	<xs:element name="latitud">
		<xs:simpleType>
			<xs:restriction base="xs:decimal">
				<xs:minInclusive value="-90" />
				<xs:maxInclusive value="90" />
			</xs:restriction>
		</xs:simpleType>
	</xs:element>

	<xs:element name="longitud">
		<xs:simpleType>
			<xs:restriction base="xs:decimal">
				<xs:minInclusive value="-180"></xs:minInclusive>
				<xs:maxInclusive value="180"></xs:maxInclusive>
			</xs:restriction>
		</xs:simpleType>
	</xs:element>

	<xs:element name="altitud">
		<xs:simpleType>
			<xs:restriction base="xs:decimal">
				<xs:minInclusive value="0"></xs:minInclusive>
				<xs:maxInclusive value="8000"></xs:maxInclusive>
			</xs:restriction>
		</xs:simpleType>
	</xs:element>

	<xs:element name="puntos">
		<xs:complexType>
			<xs:sequence>
				<xs:element minOccurs="1" maxOccurs="unbounded" ref="punto" />
			</xs:sequence>
		</xs:complexType>
	</xs:element>

	<xs:element name="punto">
		<xs:complexType>
			<xs:sequence>
				<xs:element ref="distancia" />
				<xs:element ref="coordenada" />
				<xs:element ref="sector" />
			</xs:sequence>
		</xs:complexType>
	</xs:element>

	<xs:element name="distancia">
		<xs:complexType>
			<xs:simpleContent>
				<xs:extension base="xs:float">
					<xs:attribute name="unidades" type="xs:string" use="required" />
				</xs:extension>
			</xs:simpleContent>
		</xs:complexType>
	</xs:element>

	<xs:element name="sector" type="xs:int" />
	<xs:element name="vencedor" type="xs:string" />

	<xs:element name="tresClasificados">
		<xs:complexType>
			<xs:sequence>
				<xs:element minOccurs="3" maxOccurs="3" ref="clasificado" />
			</xs:sequence>
		</xs:complexType>
	</xs:element>
	<xs:element name="clasificado" type="xs:string" />
</xs:schema>